title,url,publishedAt
These airports make passengers walk the longest distances — sometimes more than two miles to your departure gate,https://nypost.com/2024/08/17/lifestyle/the-us-airports-with-the-longest-walking-distances-to-your-gate/,2024-08-17T22:02:24Z
The AES Corporation (AES): Why Are Hedge Funds Bullish on This Defensive Stock Now?,https://finance.yahoo.com/news/aes-corporation-aes-why-hedge-192659057.html,2024-08-17T19:26:59Z
Target Corporation (TGT): Hedge Funds Are Bullish on This Defensive Stock Now,https://finance.yahoo.com/news/target-corporation-tgt-hedge-funds-192523377.html,2024-08-17T19:25:23Z
"Merck & Co., Inc. (MRK): The Best Defensive Stock Now According to Hedge Funds?",https://finance.yahoo.com/news/merck-co-inc-mrk-best-192130778.html,2024-08-17T19:21:30Z
Is Performance Food Group Company (PFGC) the Best Defensive Stock to Buy Now?,https://finance.yahoo.com/news/performance-food-group-company-pfgc-184539001.html,2024-08-17T18:45:39Z
Toothpaste Null-Terminator,https://dunkels.com/adam/sentinel-toothpaste/,2024-08-17T16:40:55Z
"The New Sonos App Is So Bad, the Company Might Bring Back the Old One",https://www.wired.com/story/new-sonos-app-is-bad-company-considers-bringing-back-the-old-one/,2024-08-17T14:00:00Z
F&O Tracker: Nifty futures gear up for a rally,https://www.thehindubusinessline.com/portfolio/commodity-analysis/fo-tracker-nifty-futures-gear-up-for-a-rally/article68533247.ece,2024-08-17T13:12:16Z
Here’s what’s new in Safari on iPhone and iPad in iOS 18,https://www.cultofmac.com/how-to/new-safari-features,2024-08-17T13:00:38Z
Index Outlook: Benchmark indices get a breather,https://www.thehindubusinessline.com/portfolio/technical-analysis/index-outlook-benchmark-indices-get-a-breather/article68535765.ece,2024-08-17T12:45:26Z
Nifty may test resistance in range-bound market; investors must guard profits and stay stock-specific,https://economictimes.indiatimes.com/markets/stocks/news/nifty-may-test-resistance-in-range-bound-market-investors-must-guard-profits-and-stay-stock-specific/articleshow/112589738.cms,2024-08-17T11:17:56Z
Nifty and Bank Nifty Prediction for the week 19 Aug’24 to 23 Aug’24 by BL GURU,https://www.thehindubusinessline.com/multimedia/video/nifty-and-bank-nifty-prediction-for-the-week-19-aug24-to-23-aug24-by-bl-guru/article68536183.ece,2024-08-17T10:56:58Z
"FPIs remain net sellers at Rs 21,201 crore in first fortnight of August. Here’s why",https://economictimes.indiatimes.com/markets/stocks/news/fpis-remain-net-sellers-at-rs-21201-crore-in-first-fortnight-of-august-heres-why/articleshow/112589046.cms,2024-08-17T10:40:03Z
"IT sector poised for new highs; Infosys, TCS to lead strong rally: Rajesh Palviya, Axis Securities",https://economictimes.indiatimes.com/markets/expert-view/it-sector-poised-for-new-highs-infosys-tcs-to-lead-strong-rally-rajesh-palviya-axis-securities/articleshow/112588319.cms,2024-08-17T10:08:07Z
"Block deals worth over Rs 8,364 crore this week. Suzlon Energy, Firstcry, Infosys among stocks with major action",https://economictimes.indiatimes.com/markets/stocks/news/block-deals-worth-over-rs-8364-crore-this-week-suzlon-energy-firstcry-infosys-among-stocks-with-major-action/articleshow/112588213.cms,2024-08-17T10:05:13Z
Q1 review: A sub 5% Nifty PAT growth earns 2% FY25 earnings downgrade from this brokerage,https://economictimes.indiatimes.com/markets/stocks/news/q1-review-a-sub-5-nifty-pat-growth-earns-2-fy25-earnings-downgrade-from-this-brokerage/articleshow/112586830.cms,2024-08-17T09:10:09Z
Bike Touring Gear List: Everything I Carry After 12 Years Around The World,https://www.cyclingabout.com/bike-touring-gear-list-around-the-world/,2024-08-17T08:09:26Z
Weekly market trends: Sectors in focus & outlook,https://economictimes.indiatimes.com/markets/stocks/news/weekly-market-trends-sectors-in-focus-outlook/articleshow/112584912.cms,2024-08-17T07:38:18Z
"F&O Talk | Nifty Bank can rally up to 52,300 in short-term, hurdle at 50,800-50,900: Sudeep Shah of SBI Securities",https://economictimes.indiatimes.com/markets/expert-view/fo-talk-nifty-bank-can-rally-up-to-52300-in-short-term-hurdle-at-50800-50900-sudeep-shah-of-sbi-securities/articleshow/112584406.cms,2024-08-17T07:06:26Z
Rush is a Nifty Android App to Look Up Song Lyrics like Spotify,https://news.itsfoss.com/rush/,2024-08-17T06:41:24Z
43 smallcap stocks post double-digit weekly gains amid market consolidation,https://economictimes.indiatimes.com/markets/stocks/news/43-smallcap-stocks-post-double-digit-weekly-gains-amid-market-consolidation/articleshow/112583229.cms,2024-08-17T06:03:17Z
India Inc: Key takeaways from Q1 results season,https://economictimes.indiatimes.com/markets/commodities/news/india-inc-key-takeaways-from-q1-results-season/articleshow/112582697.cms,2024-08-17T05:41:49Z
"Dr Reddy's Laboratories, TCS top stocks to buy post June quarter results: Siddhartha Khemka",https://economictimes.indiatimes.com/markets/stocks/news/dr-reddys-laboratories-tcs-top-stocks-to-buy-post-june-quarter-results-siddhartha-khemka/articleshow/112581031.cms,2024-08-17T05:06:03Z
Mahindra Thar Roxx Review: Taking Challenge To Mid-Size SUVs,https://www.ndtv.com/auto/mahindra-thar-roxx-first-drive-review-emerges-as-potential-compact-suv-challenger-6355471,2024-08-17T04:30:09Z
"Robust growth ignites rally in new-age stocks, 45% gains made in 6 months",https://economictimes.indiatimes.com/markets/stocks/news/robust-growth-ignites-rally-in-new-age-stocks/articleshow/112582588.cms,2024-08-17T04:26:33Z
"Robust growth ignites rally in new-age stocks, 45% gains made in 6 months",https://economictimes.indiatimes.com/markets/stocks/news/robust-growth-ignites-rally-in-new-age-stocks/articleshow/112581449.cms,2024-08-17T04:26:33Z
"Read my lipstick, beauty is equity: What Warren Buffett’s investment in a beauty company foretells about the economy",https://economictimes.indiatimes.com/markets/stocks/news/read-my-lipstick-beauty-is-equity-what-warren-buffetts-investment-in-a-beauty-company-foretells-about-the-economy/articleshow/112581010.cms,2024-08-17T03:52:16Z
2025 Mercedes-Maybach S 680 Edition Nordic Glow has a long name for a short run of cars,https://www.autoblog.com/2024/08/16/2025-mercedes-maybach-s680-edition-nordic-glow-reveal-pebble-beach-monterey/,2024-08-17T03:00:00Z
This CNC-Machined Titanium Razor will probably be the last razor you’ll ever want to buy,https://www.yankodesign.com/2024/08/16/this-cnc-machined-titanium-razor-will-probably-be-the-last-razor-youll-ever-want-to-buy/,2024-08-17T01:45:01Z
