title,url,publishedAt
US Fed's rate cut signal lifts Nifty IT to record highs,https://economictimes.indiatimes.com/markets/stocks/news/us-feds-rate-cut-signal-lifts-nifty-it-to-record-highs/articleshow/112880510.cms,2024-08-28
Making Your Way Today: 9 Tips For AI Moonshots,https://www.forbes.com/sites/johnwerner/2024/08/28/making-your-way-today-9-tips-for-ai-moonshots/,2024-08-28
This $30 solar-powered camping lantern doubles as a power bank,https://www.pcworld.com/article/2441129/this-30-solar-powered-camping-lantern-doubles-as-a-power-bank.html,2024-08-28
Mathematicians debunk GPS assumptions to offer improvements,https://phys.org/news/2024-08-mathematicians-debunk-gps-assumptions.html,2024-08-28
Chicco Kidfit Zip Plus 2-In-1 Booster Seat Review: A Top Booster Pick,https://www.forbes.com/sites/forbes-personal-shopper/2024/08/28/chicco-kidfit-zip-plus-2-in-1-booster-seat-review/,2024-08-28
Nubia Z60S Pro review: an elite tier gaming phone in a sleek disguise,https://www.pockettactics.com/nubia-z60s-pro-review,2024-08-28
Boxing Star Adds Six New Fantasy-Like Gears To Its Ring!,https://www.droidgamers.com/news/boxing-star-new/,2024-08-28
"Pixel 9 Review: Yup, It’s That Good",https://www.droid-life.com/2024/08/28/pixel-9-review-yup-its-that-good/,2024-08-28
Eerie Trailer #2 for 'Never Let Go' Horror Thriller Starring Halle Berry,https://www.firstshowing.net/2024/eerie-trailer-2-for-never-let-go-horror-thriller-starring-halle-berry/,2024-08-28
"Letters to the Editor dated August 28, 2024",https://www.thehindubusinessline.com/opinion/letters/letters-to-editor/article68578080.ece,2024-08-28
"Market Trading Guide: Wipro, Indian Bank among 8 stock recommendations for Thursday",https://m.economictimes.com/markets/stocks/news/market-trading-guide-wipro-indian-bank-among-8-stock-recommendations-for-thursday/stock-ideas/slideshow/112873433.cms,2024-08-28
Ahead of Market: 10 things that will decide stock action on Thursday,https://economictimes.indiatimes.com/markets/stocks/news/ahead-of-market-10-things-that-will-decide-stock-action-on-thursday/articleshow/112872971.cms,2024-08-28
Save $700 on this RTX 4070 gaming PC that’s absolutely stacked,https://www.pcworld.com/article/2441013/save-700-on-this-rtx-4070-gaming-pc-thats-absolutely-stacked.html,2024-08-28
"Correction in markets may lead to rise in bank deposits, SBI MD says",https://www.thehindubusinessline.com/money-and-banking/correction-in-markets-may-lead-to-rise-in-bank-deposits-sbi-md-says/article68577474.ece,2024-08-28
Breezing Through Vortex Pinnacle,https://tagn.wordpress.com/2024/08/28/breezing-through-vortex-pinnacle/,2024-08-28
Warren Buffett's Berkshire Hathaway tops $1 trillion market value,https://economictimes.indiatimes.com/markets/stocks/news/warren-buffetts-berkshire-hathaway-tops-1-trillion-market-value/articleshow/112871039.cms,2024-08-28
"Tencent likely to sell 2.1% stake in PB Fintech via block deal for Rs 1,610 crore: Report",https://economictimes.indiatimes.com/markets/stocks/news/tencent-likely-to-sell-2-1-stake-in-pb-fintech-via-block-deal-for-rs-1610-crore-report/articleshow/112871333.cms,2024-08-28
"Tencent likely to sell 2.1% stake in PB Fintech via block deal for Rs 1,610 crore: Report",https://economictimes.indiatimes.com/markets/stocks/news/tencent-likely-to-sell-2-1-stake-in-pb-fintech-via-block-deal-for-rs-1610-crore-report/articleshow/112870605.cms,2024-08-28
I flew a big-name airline and a budget competitor across the Atlantic. The low-cost option is worth it if you follow the rules.,https://www.businessinsider.com/virgin-atlantic-vs-norse-airways-usa-europe-compared-review-2024-8,2024-08-28
Nifty records fresh high after longest winning streak in four years,https://www.business-standard.com/markets/news/nifty-records-fresh-high-after-longest-winning-streak-in-four-years-124082801131_1.html,2024-08-28
Tata Steel acquires 178 crore shares in Singapore arm TSHP for USD 280 million,https://economictimes.indiatimes.com/markets/stocks/news/tata-steel-acquires-178-crore-shares-in-singapore-arm-tshp-for-usd-280-million/articleshow/112870397.cms,2024-08-28
This Secret Trick Will Help Decrease Your Haunted Mansion Wait Time,https://insidethemagic.net/2024/08/haunted-mansion-decrease-wait-time-kc1/,2024-08-28
"The Lord Of The Rings: The Rings Of Power Season 2 Review: A Darker, Bolder, & More Complex Return To Form",https://www.slashfilm.com/1651616/lord-of-the-rings-the-rings-of-power-season-2-review/,2024-08-28
"Metaphor: ReFantazio is shaping up to be far larger than Persona, and I've already fallen in love with its high fantasy twist on traditional RPGs",https://www.gamesradar.com/games/rpg/metaphor-refantazio-is-shaping-up-to-be-far-larger-than-persona-and-ive-already-fallen-in-love-with-its-high-fantasy-twist-on-traditional-rpgs/,2024-08-28
ACOPOWER LiONCooler Pro Portable Solar Fridge Freezer review,https://the-gadgeteer.com/2024/08/28/acopower-lioncooler-pro-portable-solar-fridge-freezer-review/,2024-08-28
PDS raises Rs 430 cr through QIP,https://economictimes.indiatimes.com/markets/stocks/news/pds-raises-rs-430-cr-through-qip/articleshow/112869826.cms,2024-08-28
"Square Yards reports 52% YoY growth in Q1 FY25, hits Rs 261 crore revenue",https://economictimes.indiatimes.com/markets/stocks/earnings/square-yards-reports-52-yoy-growth-in-q1-fy25-hits-rs-261-crore-revenue/articleshow/112869750.cms,2024-08-28
"'Indian women wear unbelievable amounts of gold, silver,' says Jim Rogers",https://www.business-standard.com/social-viral/indian-women-wear-unbelievable-amounts-of-gold-silver-says-jim-rogers-124082801010_1.html,2024-08-28
"Tech View: Nifty needs decisive move above 25,100 for uptrend. Here’s how to trade on Thursday",https://economictimes.indiatimes.com/markets/stocks/news/tech-view-nifty-needs-decisive-move-above-25100-for-uptrend-heres-how-to-trade-on-thursday/articleshow/112869125.cms,2024-08-28
"Sensex rises 74 pts, Nifty hits record high; LTIMindtree soars 6.5%",https://www.business-standard.com/markets/capital-market-news/sensex-rises-74-pts-nifty-hits-record-high-ltimindtree-soars-6-5-124082801000_1.html,2024-08-28
Althoff looking to rebound after run to Class 1A quarterfinals: No. 2 small school,https://www.stltoday.com/sports/high-school/football/althoff-looking-to-rebound-after-run-to-class-1a-quarterfinals-no-2-small-school/article_15304fb4-5dc2-11ef-a371-33f37ed5ca75.html,2024-08-28
Stock market update: Nifty Auto index falls 0.13%,https://economictimes.indiatimes.com/markets/stocks/stock-watch/stock-market-update-nifty-auto-index-falls-0-13/articleshow/112867869.cms,2024-08-28
Vedanta board to consider third interim dividend on September 2,https://economictimes.indiatimes.com/markets/stocks/news/vedanta-board-to-consider-third-interim-dividend-on-september-2/articleshow/112867776.cms,2024-08-28
Share market update: Most active stocks of the day in terms of traded value,https://economictimes.indiatimes.com/markets/stocks/stock-watch/share-market-update-most-active-stocks-of-the-day-in-terms-of-traded-value/articleshow/112867694.cms,2024-08-28
Stock market update: Sugar stocks up as market rises,https://economictimes.indiatimes.com/markets/stocks/stock-watch/stock-market-update-sugar-stocks-up-as-market-rises/articleshow/112867533.cms,2024-08-28
Stock market update: Stocks that hit 52-week highs on NSE in today's trade,https://economictimes.indiatimes.com/markets/stocks/stock-watch/stock-market-update-stocks-that-hit-52-week-highs-on-nse-in-todays-trade/articleshow/112867416.cms,2024-08-28
Stock market update: Nifty Pharma index advances 1.14%,https://economictimes.indiatimes.com/markets/stocks/stock-watch/stock-market-update-nifty-pharma-index-advances-1-14/articleshow/112866823.cms,2024-08-28
Sensex rises! But these stocks fell 5% or more in Wednesday's session,https://economictimes.indiatimes.com/markets/stocks/stock-watch/sensex-rises-but-these-stocks-fell-5-or-more-in-wednesdays-session/articleshow/112866615.cms,2024-08-28
Stock market update: FMCG stocks down as market rises,https://economictimes.indiatimes.com/markets/stocks/stock-watch/stock-market-update-fmcg-stocks-down-as-market-rises/articleshow/112866474.cms,2024-08-28
Stock market update: Mining stocks down as market rises,https://economictimes.indiatimes.com/markets/stocks/stock-watch/stock-market-update-mining-stocks-down-as-market-rises/articleshow/112866299.cms,2024-08-28
Stock market update: Power stocks down as market rises,https://economictimes.indiatimes.com/markets/stocks/stock-watch/stock-market-update-power-stocks-down-as-market-rises/articleshow/112866142.cms,2024-08-28
Nifty gains marginally to hit lifetime high,https://www.thehindubusinessline.com/markets/nifty-gains-marginally-to-hit-lifetime-high/article68576584.ece,2024-08-28
Stock market update: Nifty Realty index falls 0.18%,https://economictimes.indiatimes.com/markets/stocks/stock-watch/stock-market-update-nifty-realty-index-falls-0-18/articleshow/112865937.cms,2024-08-28
Worms Armageddon On Switch Will Also Contain The Game Boy Color Version,https://www.nintendolife.com/news/2024/08/worms-armageddon-on-switch-will-also-contain-the-game-boy-color-version,2024-08-28
Stock market update: Nifty Bank index falls 0.26%,https://economictimes.indiatimes.com/markets/stocks/stock-watch/stock-market-update-nifty-bank-index-falls-0-26/articleshow/112865498.cms,2024-08-28
Stock market update: Fertilisers stocks down as market rises,https://economictimes.indiatimes.com/markets/stocks/stock-watch/stock-market-update-fertilisers-stocks-down-as-market-rises/articleshow/112865352.cms,2024-08-28
India stocks higher at close of trade; Nifty 50 up 0.14%,https://www.investing.com/news/stock-market-news/india-stocks-higher-at-close-of-trade-nifty-50-up-014-3590452,2024-08-28
"Market Wrap: Nifty hits record closing high, Sensex closes in on peak as IT stock gains extend D-Street rally",https://economictimes.indiatimes.com/markets/stocks/news/nifty-hits-record-high-sensex-closes-in-on-peak-as-it-stock-gains-extend-d-street-rally/articleshow/112864942.cms,2024-08-28
Share market update: Most active stocks in today's market in terms of volume,https://economictimes.indiatimes.com/markets/stocks/stock-watch/share-market-update-most-active-stocks-in-todays-market-in-terms-of-volume/articleshow/112865148.cms,2024-08-28
Why this fund wants to keep equal weight across 500 stocks,https://www.livemint.com/money/personal-finance/nippon-india-nifty-500-equal-weight-index-fund-largecap-midcap-smallcap-stocks-11724773645339.html,2024-08-28
"Gainers & Losers: NBCC, Trent among 5 stocks that hogged limelight on Wednesday",https://m.economictimes.com/markets/web-stories/gainers-amp-losers-nbcc-trent-among-5-stocks-that-hogged-limelight-on-wednesday/slideshow/112864864.cms,2024-08-28
Nifty hits record high; IT shares rally; VIX rises 2.32%,https://www.business-standard.com/markets/capital-market-news/nifty-hits-record-high-it-shares-rally-vix-rises-2-32-124082800785_1.html,2024-08-28
Akhil Chaturvedi on how SIPs and lump sums are shaping India's investment landscape,https://economictimes.indiatimes.com/markets/expert-view/akhil-chaturvedi-on-how-sips-and-lump-sums-are-shaping-indias-investment-landscape/articleshow/112863750.cms,2024-08-28
"Trent rallies 7%, hits new high; stock zooms 41% in 15 trading days",https://www.business-standard.com/markets/news/trent-rallies-7-hits-new-high-stock-zooms-41-in-15-trading-days-124082800684_1.html,2024-08-28
"Infosys, Bharti Airtel among 6 Nifty50 stocks hitting new 52-week highs on Wednesday",https://m.economictimes.com/markets/stocks/news/infosys-bharti-airtel-among-6-nifty50-stocks-hitting-new-52-week-highs-on-wednesday/new-highs/slideshow/112864042.cms,2024-08-28
"Nifty at record high: Bharti Airtel, IndiGo among 317 stocks that hit 52-week highs",https://economictimes.indiatimes.com/markets/stocks/news/nifty-at-record-high-bharti-airtel-indigo-among-317-stocks-that-hit-52-week-highs/articleshow/112863364.cms,2024-08-28
PDS raises Rs 430 cr through QIP,https://economictimes.indiatimes.com/markets/stocks/news/pds-raises-rs-430-cr-through-qip/articleshow/112863126.cms,2024-08-28
Sensex gains 279 pts; PSU banks decline,https://www.business-standard.com/markets/capital-market-news/sensex-gains-279-pts-psu-banks-decline-124082800613_1.html,2024-08-28
Gurmeet Chadha on what's fuelling the market rally and where it's headed next,https://economictimes.indiatimes.com/markets/expert-view/gurmeet-chadha-on-whats-fuelling-the-market-rally-and-where-its-headed-next/articleshow/112861700.cms,2024-08-28
Tata Elxsi shares down 6.99% as Nifty gains,https://economictimes.indiatimes.com/markets/stocks/stock-watch/tata-elxsi-shares-down-6-99-as-nifty-gains/articleshow/112861602.cms,2024-08-28
Starlink by SpaceX to offer free emergency SOS on all phones worldwide,https://www.androidpolice.com/spacex-starlink-free-emergency-sos-worldwide-elon-musk/,2024-08-28
Are you a smart investor? Time for a reality check.,https://www.livemint.com/opinion/online-views/stock-market-investment-performance-psychology-of-investing-luck-skill-smart-investors-nifty-11724788007776.html,2024-08-28
Basic materials shares fall,https://www.business-standard.com/markets/capital-market-news/basic-materials-shares-fall-124082800544_1.html,2024-08-28
Real Estate stocks edge lower,https://www.business-standard.com/markets/capital-market-news/real-estate-stocks-edge-lower-124082800542_1.html,2024-08-28
FMCG shares fall,https://www.business-standard.com/markets/capital-market-news/fmcg-shares-fall-124082800543_1.html,2024-08-28
What’s driving Nifty to new all-time highs? Mihir Vora answers,https://economictimes.indiatimes.com/markets/expert-view/whats-driving-nifty-to-new-all-time-highs-mihir-vora-answers/articleshow/112860717.cms,2024-08-28
Bharat Forge shares down 1.31% as Nifty gains,https://economictimes.indiatimes.com/markets/stocks/stock-watch/bharat-forge-shares-down-1-31-as-nifty-gains/articleshow/112860853.cms,2024-08-28
"Kalyani Steels replaces TCNS in Nifty Microcap, Total Market",https://www.business-standard.com/markets/capital-market-news/kalyani-steels-replaces-tcns-in-nifty-microcap-total-market-124082800527_1.html,2024-08-28
"IT stocks: LTIM, Wipro, LTTS, Mphasis soared up to 8% today; here's why",https://www.business-standard.com/markets/news/it-stocks-ltim-wipro-ltts-mphasis-soared-up-to-8-today-here-s-why-124082800508_1.html,2024-08-28
Adani Enterprises Ltd drops for fifth straight session,https://www.business-standard.com/markets/capital-market-news/adani-enterprises-ltd-drops-for-fifth-straight-session-124082800531_1.html,2024-08-28
How to trade Reliance stock ahead of its AGM on Aug 29? Key levels here,https://www.business-standard.com/markets/news/how-to-trade-reliance-stock-ahead-of-its-agm-on-aug-29-key-levels-here-124082800482_1.html,2024-08-28
"Nifty holds 25,100 level; European mkt opens higher",https://www.business-standard.com/markets/capital-market-news/nifty-holds-25-100-level-european-mkt-opens-higher-124082800526_1.html,2024-08-28
Here is what to keep in mind when investing with a new fund house,https://www.livemint.com/money/personal-finance/mutual-funds-new-fund-houses-new-funds-nfos-things-to-remember-while-investing-pms-capitalmind-11724785264402.html,2024-08-28
HDFC AMC shares down 0.74% as Nifty gains,https://economictimes.indiatimes.com/markets/stocks/stock-watch/hdfc-amc-shares-down-0-74-as-nifty-gains/articleshow/112860438.cms,2024-08-28
"Play the rally with newer sectors; metals, 2 more sectors the dark horse for next 12 months: Gautam Shah",https://economictimes.indiatimes.com/markets/expert-view/play-the-rally-with-newer-sectors-metals-2-more-sectors-the-dark-horse-for-next-12-months-gautam-shah/articleshow/112860208.cms,2024-08-28
Indices trade higher; IT stocks lead gains,https://www.thehindubusinessline.com/markets/indices-trade-higher-it-stocks-lead-gains/article68576069.ece,2024-08-28
"6 Adani stocks, LIC, and 3 PSUs slip below 20 & 50 DMAs: What should investors do?",https://economictimes.indiatimes.com/markets/stocks/news/6-adani-stocks-lic-and-3-psus-slip-below-20-50-dmas-what-should-investors-do/articleshow/112860222.cms,2024-08-28
Expect Nifty to hit new highs for next 2-3 weeks: Rohit Srivastava,https://economictimes.indiatimes.com/markets/expert-view/expect-nifty-to-hit-new-highs-for-next-2-3-weeks-rohit-srivastava/articleshow/112859856.cms,2024-08-28
Ashok Leyland shares up 0.13% as Nifty gains,https://economictimes.indiatimes.com/markets/stocks/stock-watch/ashok-leyland-shares-up-0-13-as-nifty-gains/articleshow/112859745.cms,2024-08-28
Sun TV Network Ltd up for third consecutive session,https://www.business-standard.com/markets/capital-market-news/sun-tv-network-ltd-up-for-third-consecutive-session-124082800491_1.html,2024-08-28
Mphasis Ltd up for third consecutive session,https://www.business-standard.com/markets/capital-market-news/mphasis-ltd-up-for-third-consecutive-session-124082800489_1.html,2024-08-28
"Infosys Ltd spurts 2.52%, up for third straight session",https://www.business-standard.com/markets/capital-market-news/infosys-ltd-spurts-2-52-up-for-third-straight-session-124082800490_1.html,2024-08-28
LTIMindtree Ltd spurts 7.53%,https://www.business-standard.com/markets/capital-market-news/ltimindtree-ltd-spurts-7-53-124082800487_1.html,2024-08-28
"Alkem Laboratories Ltd soars 1.08%, Gains for third straight session",https://www.business-standard.com/markets/capital-market-news/alkem-laboratories-ltd-soars-1-08-gains-for-third-straight-session-124082800493_1.html,2024-08-28
Lupin Ltd up for third consecutive session,https://www.business-standard.com/markets/capital-market-news/lupin-ltd-up-for-third-consecutive-session-124082800492_1.html,2024-08-28
"Coforge Ltd soars 3.55%, Gains for third straight session",https://www.business-standard.com/markets/capital-market-news/coforge-ltd-soars-3-55-gains-for-third-straight-session-124082800488_1.html,2024-08-28
"SBI Cards & Payment Services Ltd soars 0.13%, rises for fifth straight session",https://www.business-standard.com/markets/capital-market-news/sbi-cards-payment-services-ltd-soars-0-13-rises-for-fifth-straight-session-124082800466_1.html,2024-08-28
"National Aluminium Company Ltd spurts 0.08%, rises for fifth straight session",https://www.business-standard.com/markets/capital-market-news/national-aluminium-company-ltd-spurts-0-08-rises-for-fifth-straight-session-124082800467_1.html,2024-08-28
Aurobindo Pharma Ltd up for fifth session,https://www.business-standard.com/markets/capital-market-news/aurobindo-pharma-ltd-up-for-fifth-session-124082800468_1.html,2024-08-28
GAIL shares 0.0% as Sensex climbs,https://economictimes.indiatimes.com/markets/stocks/stock-watch/gail-shares-0-0-as-sensex-climbs/articleshow/112859477.cms,2024-08-28
Ambuja Cements shares drop 1.16% as Sensex rises,https://economictimes.indiatimes.com/markets/stocks/stock-watch/ambuja-cements-shares-drop-1-16-as-sensex-rises/articleshow/112859308.cms,2024-08-28
Nasdaq seeks SEC approval for bitcoin index options,https://economictimes.indiatimes.com/markets/cryptocurrency/nasdaq-seeks-sec-approval-for-bitcoin-index-options/articleshow/112858900.cms,2024-08-28
Crompton Greaves shares drop 0.67% as Sensex rises,https://economictimes.indiatimes.com/markets/stocks/stock-watch/crompton-greaves-shares-drop-0-67-as-sensex-rises/articleshow/112858885.cms,2024-08-28
Siemens shares down 0.24% as Nifty gains,https://economictimes.indiatimes.com/markets/stocks/stock-watch/siemens-shares-down-0-24-as-nifty-gains/articleshow/112858706.cms,2024-08-28
Nifty hits record high; pharma shares advance,https://www.business-standard.com/markets/capital-market-news/nifty-hits-record-high-pharma-shares-advance-124082800436_1.html,2024-08-28
Voltas shares fall 0.12 per cent in Wednesday's trading session,https://economictimes.indiatimes.com/markets/stocks/stock-watch/voltas-shares-fall-0-12-per-cent-in-wednesdays-trading-session/articleshow/112858525.cms,2024-08-28
Tube Investments shares fall 0.74 per cent in Wednesday's trading session,https://economictimes.indiatimes.com/markets/stocks/stock-watch/tube-investments-shares-fall-0-74-per-cent-in-wednesdays-trading-session/articleshow/112858341.cms,2024-08-28
F&O Stock Strategy: How to trade PFC and Bajaj Finserv,https://economictimes.indiatimes.com/markets/options/fo-stock-strategy-how-to-trade-pfc-and-bajaj-finserv/articleshow/112857731.cms,2024-08-28
Pidilite Ind shares down 0.55% as Nifty gains,https://economictimes.indiatimes.com/markets/stocks/stock-watch/pidilite-ind-shares-down-0-55-as-nifty-gains/articleshow/112858164.cms,2024-08-28
Share price of ICICI Lombard rises as Nifty strengthens,https://economictimes.indiatimes.com/markets/stocks/stock-watch/share-price-of-icici-lombard-rises-as-nifty-strengthens/articleshow/112857712.cms,2024-08-28
