title,url,publishedAt,description
"What to know about DJ Lagway, who made his first career start as Florida football QB vs Samford",https://www.gainesville.com/story/sports/college/football/2024/09/07/five-things-to-know-about-florida-football-qb-dj-lagway-in-starting-debut-billy-napier-tim-tebow/75095449007/,2024-09-07T23:07:56Z,"Florida football QB DJ Lagway made his first career start vs Samford. Here's what to know about the strong-armed, freshman Texan"
Reddies pull away from Tigers with strong finish,https://www.theadanews.com/oklahoma/sports/reddies-pull-away-from-tigers-with-strong-finish/article_22f89aa2-6c63-11ef-9962-7788d57f81c9.html,2024-09-07T19:51:00Z,"Sep. 7—The East Central University football team stole all the momentum against No. 22 Henderson State when standout cornerback Gio Waller stole the ball for the Tigers early in the third quarter. Waller, a senior from San Antonio, Texas, scooped up a fumble …"
You should download your offline Google maps on your Pixel Watch right away,https://www.androidauthority.com/download-offline-google-maps-now-3477925/,2024-09-07T18:00:25Z,Google Maps has rolled out the option to download offline maps on Wear OS smartwatches. Here's how to do it and why.
Should You Run Servo Horns Or Direct Couplings In Your RC Planes?,https://hackaday.com/2024/09/07/should-you-run-servo-horns-or-direct-couplings-in-your-rc-planes/,2024-09-07T17:00:42Z,"Whenever you buy a servo, it usually comes with a little baggie full of various plastic horns. Most of us pick our favorite and use it in our projects. Some of us hack them up, glue them back toget…"
Canon RF 50mm Showdown: Premium vs. Budget,https://fstoppers.com/reviews/canon-rf-50mm-showdown-premium-vs-budget-678879,2024-09-07T16:03:01Z,"The Canon RF 50mm f/1.2 L lens is a powerhouse, offering exceptional image quality and features at a hefty price of around $2,000. On the other hand, the RF 50mm f/1.8, affectionately known as the ""nifty fifty,"" costs just $200. With such a huge price differe…"
"Climbing Vacuums, AI Ovens, and a Wire-Free Kitchen: The Best Smart Home Tech of IFA 2024",https://me.pcmag.com/en/robot-vacuums/25702/climbing-vacuums-ai-ovens-and-a-wire-free-kitchen-the-best-smart-home-tech-of-ifa-2024,2024-09-07T13:00:00Z,"From robot vacuums that scale steps to AI-equipped appliances, IFA Berlin delivered tons of new innovations to make your smart home even more connected and convenient.
BERLIN–IFA celebrated its 100th birthday this year, and while the annual European tradeshow…"
"'The Perfect Couple' is 6 episodes of simple, soapy fun",https://www.npr.org/2024/09/07/nx-s1-5103908/the-perfect-couple-netflix-nicole-kidman,2024-09-07T13:00:00Z,"Nicole Kidman stars in a juicy, nifty little end-of-summer mystery on Netflix — where the people are beautiful, the arguments are public and sloppy, the house is gorgeous and the drinks are bottomless."
"Climbing Vacuums, AI Ovens, and a Wire-Free Kitchen: The Best Smart Home Tech of IFA 2024",https://uk.pcmag.com/robot-vacuums/154254/climbing-vacuums-ai-ovens-and-a-wire-free-kitchen-the-best-smart-home-tech-of-ifa-2024,2024-09-07T13:00:00Z,"From robot vacuums that scale steps to AI-equipped appliances, IFA Berlin delivered tons of new innovations to make your smart home even more connected and convenient.
BERLIN–IFA celebrated its 100th birthday this year, and while the annual European tradeshow…"
The Kindle-like TCL 50 Pro Nxtpaper 5G goes all in on inky goodness,https://www.pockettactics.com/tcl-50-pro-nxtpaper-5g,2024-09-07T12:27:51Z,"If you're looking to escape into a good book, but don't want to carry around another device like a Kindle with you, the TCL 50 Pro Nxtpaper 5G might be the answer to your problems. TCL's combination of the sleek mobile phone hardware and e-book goodness is on…"
Dalal Street Week Ahead: Nifty may continue to remain under corrective pressure,https://economictimes.indiatimes.com/markets/stocks/news/dalal-street-week-ahead-nifty-may-continue-to-remain-under-corrective-pressure/articleshow/113149511.cms,2024-09-07T10:08:44Z,"The volatility spiked as well; the volatility barometer India VIX surged by 13.63% to 15.22 on a weekly basis. While setting a distinct corrective undertone, the headline index closed with a net weekly loss of 383.75 points (-1.52%)"
"F&O Talk| Nifty faces reversal signals and weaker breadth, key support at 24,500-24,400: Sudeep Shah of SBI Securities",https://economictimes.indiatimes.com/markets/expert-view/fo-talk-nifty-faces-reversal-signals-and-weaker-breadth-key-support-at-24500-24400-sudeep-shah-of-sbi-securities/articleshow/113149013.cms,2024-09-07T09:46:48Z,"The 50 component index Nifty 50 as well Sensex closed nearly 1.2% lower today. The former closed 293 points lower at 24,852 while the latter dipped by 1,017 points to 81,184."
Talking Point: What Are You Playing This Weekend? (7th September),https://www.nintendolife.com/features/talking-point-what-are-you-playing-this-weekend-7th-september,2024-09-07T09:00:00Z,"We got crystals to find, mate.It's the weekend once again, so it's time to wash off the stresses of the work week and relax with a bit of gaming. But before we settle in, let's recap some of the bigger stories from this week.First up, it was a big week for 'S…"
'It was a social event': Music fans on the joy - and pain - of queuing for gig tickets,https://www.thejournal.ie/queuing-for-gig-tickets-ireland-1990s-2000s-6478761-Sep2024/,2024-09-07T05:30:38Z,"In the pre-internet days, camping overnight for tickets was all part of the fun."
3 reasons why Indian pharma is getting ready for unstoppable growth,https://economictimes.indiatimes.com/markets/stocks/news/3-reasons-why-indian-pharma-is-getting-ready-for-unstoppable-growth/articleshow/113143854.cms,2024-09-07T05:23:31Z,"For Indian pharmaceutical companies, this scenario presents a distinct opportunity. Leveraging their established expertise and leadership in global COVID-19 vaccine distribution, along with robust supply chain efficiencies, Indian firms are strategically posi…"
Not too concerned about Goldman downgrading; SBI one of the top bets in portfolio: Ashi Anand,https://economictimes.indiatimes.com/markets/expert-view/not-too-concerned-about-goldman-downgrading-sbi-one-of-the-top-bets-in-portfolio-ashi-anand/articleshow/113143644.cms,2024-09-07T05:08:03Z,"Ashi Anand, Founder of IME Capital, expresses confidence in SBI despite a downgrade by Goldman Sachs. He highlights the bank's attractive growth and profitability. Anand also mentions increased weights in consumption and FMCG sectors due to signs of rural rec…"
45 smallcap stocks buck the trend to offer double-digit weekly returns amid sharp sell-off,https://economictimes.indiatimes.com/markets/stocks/news/45-smallcap-stocks-buck-the-trend-to-offer-double-digit-weekly-returns-amid-sharp-sell-off/articleshow/113142809.cms,2024-09-07T04:03:47Z,"Rama Steel Tubes was the top gainer in the smallcap pack with nearly 60% return, followed by Refex Industries (32.3%), Kitex Garments (27%), and 63 Moons Technologies (26%)."
Beetlejuice Beetlejuice Is Pretty Boring And Forgettable. {Review},https://bleedingcool.com/movies/beetlejuice-beetlejuice-review-not-great-keaton-burton-ryder-ortega/,2024-09-07T03:47:11Z,"Beetlejuice Beetlejuice falls into the same trap that many other legacy sequels have, and that is justifying its existence. The first half of the movie is quite bad, with it being clear that this film has gone through many rewrites and scripts over the years,…"
3 top stock recommendations from Rajesh Palviya for next week,https://economictimes.indiatimes.com/markets/expert-view/3-top-stock-recommendations-from-rajesh-palviya/articleshow/113129915.cms,2024-09-07T03:31:00Z,"​Looking at the near-term structure, if we sustain below to 25,000 level, yes, possibly we could see furthermore supply pressure in the continuation of this down move."
India overtakes China in MSCI EM Investable Market Index,https://economictimes.indiatimes.com/markets/stocks/news/india-overtakes-china-in-msci-em-investable-market-index/articleshow/113141944.cms,2024-09-07T02:46:44Z,"In the MSCI Standard Index, which focuses on large and mid-cap companies, China retains the top weight at 24%, with India following at around 20%. India reclaimed the second spot in the index last November, overtaking Taiwan."
Dalal Street indices tank on weak global cues,https://economictimes.indiatimes.com/markets/stocks/news/dalal-street-indices-tank-on-weak-global-cues/articleshow/113141439.cms,2024-09-07T02:00:48Z,"The regulations require overseas investment vehicles to provide granular details of all entities holding any ownership, economic interest, or exercising control, failing which they must liquidate their domestic holdings."
‘Unstoppable’ Review: Jennifer Lopez And Jharrel Jerome Both Wrestle With The Odds Against Them In Inspiring True Story – Toronto Film Festival,http://deadline.com/2024/09/unstoppable-review-jennifer-lopez-jharrel-jerome-toronto-film-festival-1236079773/,2024-09-07T01:00:00Z,"It has almost gotten to the point where inspiring sports stories almost become a parody of themselves, so overrun is the genre with every conceivable variation. But with Unstoppable (not to be confused with the 2004 Wesley Snipes Unstoppable or the 2010 Denze…"
Turn any bike into an e-bike in seconds with this nifty gadget - Fox News,https://slashdot.org/firehose.pl?op=view&amp;id=174938830,2024-09-07T00:52:16Z,Turn any bike into an e-bike in seconds with this nifty gadgetFox News View Full Coverage on Google News ...
