title,url,publishedAt,description
European stock markets rise at open,https://economictimes.indiatimes.com/markets/stocks/news/european-stock-markets-rise-at-open/articleshow/113186763.cms,2024-09-09T07:43:55Z,"European stock markets climbed at the open Monday, recovering slightly from heavy pre-weekend falls on US economic strains, as investors await an expected interest-rate cut from the European Central Bank. The European Central Bank is set to cut eurozone borro…"
Ashok Leyland shares drop 2.13% as Sensex rises,https://economictimes.indiatimes.com/markets/stocks/stock-watch/ashok-leyland-shares-drop-2-13-as-sensex-rises/articleshow/113186620.cms,2024-09-09T07:38:41Z,"On the technical charts, the RSI of the stock stood at 39.48."
Gland Pharma Ltd gains for third straight session,https://www.business-standard.com/markets/capital-market-news/gland-pharma-ltd-gains-for-third-straight-session-124090900459_1.html,2024-09-09T07:35:00Z,"Gland Pharma Ltd is quoting at Rs 1936.35, up 1.59% on the day as on 12:49 IST on the NSE. The stock is up 14.9% in last one year as compared to a 24.3% jump in NIFTY and a 50.09% jump in the Nifty Pharma index."
Shares of Vedanta fall as Nifty gains,https://economictimes.indiatimes.com/markets/stocks/stock-watch/shares-of-vedanta-fall-as-nifty-gains/articleshow/113186471.cms,2024-09-09T07:33:35Z,"On the technical charts, the 200-day moving average of the stock stood at Rs 354.78."
"Divis Laboratories Ltd spurts 0.46%, rises for fifth straight session",https://www.business-standard.com/markets/capital-market-news/divis-laboratories-ltd-spurts-0-46-rises-for-fifth-straight-session-124090900458_1.html,2024-09-09T07:30:00Z,"Divis Laboratories Ltd is quoting at Rs 5161.25, up 0.46% on the day as on 12:44 IST on the NSE. The stock is up 38.14% in last one year as compared to a 24.3% spurt in NIFTY and a 49.95% spurt in the Nifty Pharma."
HDFC AMC shares down 0.54% as Sensex rises,https://economictimes.indiatimes.com/markets/stocks/stock-watch/hdfc-amc-shares-down-0-54-as-sensex-rises/articleshow/113186073.cms,2024-09-09T07:23:26Z,"A total of 4,910 shares changed hands on the counter till 12:53PM (IST)"
Nifty PSU Bank index dips below 200-DMA after more than 2 years; what next?,https://www.business-standard.com/markets/news/nifty-psu-bank-index-dips-below-200-dma-after-more-than-2-years-what-next-124090900386_1.html,2024-09-09T07:10:02Z,"The PSU Bank index had zoomed 200% to a high of 8,053 after breaking above its 200-DMA in July 2022. At present, most PSU Bank stocks, barring SBI, are trading below this long-term moving average: nifty psu bank index"
Electric two wheeler-maker Ather Energy files for IPO,https://economictimes.indiatimes.com/markets/ipos/fpos/electric-two-wheeler-maker-ather-energy-files-for-ipo/articleshow/113185556.cms,2024-09-09T07:05:46Z,"Ather Energy, an Indian manufacturer of electric two-wheelers, has submitted a draft red herring prospectus for an IPO, which includes a fresh issue of shares valued at Rs 3,100 crore ($369.4 million), the company announced on Monday."
Watch Review: Bremont Terra Nova Chronograph,https://www.ablogtowatch.com/watch-review-bremont-terra-nova-chronograph/,2024-09-09T07:01:42Z,"When I introduced the new Bremont and its field line and revamped diver line, the ire was as fresh as the news itself. I stand by what I said then: Bremont’s rebranding was abrupt, haphazard, and generic, and it left most people confused. Four months later, t…"
"Nifty tad above 24,850 mark; FMCG shares in demand",https://www.business-standard.com/markets/capital-market-news/nifty-tad-above-24-850-mark-fmcg-shares-in-demand-124090900403_1.html,2024-09-09T06:56:00Z,"At 12:30 IST, the barometer index, the S&P BSE Sensex added 38.23 points or 0.06% to 81,244.03. The Nifty 50 index rose 1.50 points or 0.01% to 24,853.65."
Tata Elxsi shares drop 0.87% as Sensex rises,https://economictimes.indiatimes.com/markets/stocks/stock-watch/tata-elxsi-shares-drop-0-87-as-sensex-rises/articleshow/113185170.cms,2024-09-09T06:52:56Z,"A total of 4,120 shares changed hands on the counter till 12:22PM (IST)"
PI Industries shares drop 0.42% as Sensex rises,https://economictimes.indiatimes.com/markets/stocks/stock-watch/pi-industries-shares-drop-0-42-as-sensex-rises/articleshow/113185016.cms,2024-09-09T06:47:47Z,"A total of 3,334 shares changed hands on the counter till 12:17PM (IST)"
"PSBs extend fall after Goldman Sachs downgrades SBI; Canara, UBI down 3%",https://www.business-standard.com/markets/news/psbs-extend-fall-after-goldman-sachs-downgrades-sbi-canara-ubi-down-3-124090900319_1.html,2024-09-09T06:40:44Z,"The Nifty PSU Bank index, the top loser among sectoral indices, was down 1.1 per cent at 6,581.40, as compared to the 0.16 per cent rise in the Nifty 50 at 11:14 AM on Monday."
Share price of Ambuja Cements falls as Sensex gains 106.23 points,https://economictimes.indiatimes.com/markets/stocks/stock-watch/share-price-of-ambuja-cements-falls-as-sensex-gains-106-23-points/articleshow/113184721.cms,2024-09-09T06:37:33Z,"A total of 15,933 shares changed hands on the counter till 12:06PM (IST)"
Barometers pare losses; oil & gas shares slide for 5th day,https://www.business-standard.com/markets/capital-market-news/barometers-pare-losses-oil-gas-shares-slide-for-5th-day-124090900346_1.html,2024-09-09T06:09:00Z,"At 11:30 IST, the barometer index, the S&P BSE Sensex rose 118.14 points or 0.15% to 81,305.50. The Nifty 50 index added 24.55 points or 0.10% to 24,876.70."
Havells India shares up 0.36% as Sensex rises,https://economictimes.indiatimes.com/markets/stocks/stock-watch/havells-india-shares-up-0-36-as-sensex-rises/articleshow/113183482.cms,2024-09-09T06:01:53Z,"A total of 4,017 shares changed hands on the counter till 11:31AM (IST)"
LTIMindtree shares drop 0.12% as Sensex rises,https://economictimes.indiatimes.com/markets/stocks/stock-watch/ltimindtree-shares-drop-0-12-as-sensex-rises/articleshow/113183326.cms,2024-09-09T05:56:47Z,"A total of 3,571 shares changed hands on the counter till 11:26AM (IST)"
Stock market update: Mining stocks down as market rises,https://economictimes.indiatimes.com/markets/stocks/stock-watch/stock-market-update-mining-stocks-down-as-market-rises/articleshow/113183282.cms,2024-09-09T05:55:33Z,The 30-share BSE Sensex was  up  119.98 points at 81303.91
Share market update: Most active stocks of the day in terms of total traded value,https://economictimes.indiatimes.com/markets/stocks/stock-watch/share-market-update-most-active-stocks-of-the-day-in-terms-of-total-traded-value/articleshow/113183077.cms,2024-09-09T05:50:27Z,The NSE Nifty index was trading 40.5 points  up  at 24892.65
"Bank Nifty Prediction today – Sep 9, 2024: Index facing a strong barrier, go short",https://www.thehindubusinessline.com/portfolio/technical-analysis/bank-nifty-prediction-today-sep-9-2024-index-facing-a-strong-barrier-go-short/article68620860.ece,2024-09-09T05:45:00Z,"Bank Nifty index up 0.4%, private banks outperforming public sector peers, futures trading at 50,970, resistance at 51,000."
Shares of Varun Beverages rise as Nifty gains,https://economictimes.indiatimes.com/markets/stocks/stock-watch/shares-of-varun-beverages-rise-as-nifty-gains/articleshow/113182857.cms,2024-09-09T05:41:27Z,"On the technical charts, the 200-day moving average of the stock stood at Rs 1414.35."
Stock market update: Nifty Pharma index advances 0.02% in an upbeat market,https://economictimes.indiatimes.com/markets/stocks/stock-watch/stock-market-update-nifty-pharma-index-advances-0-02-in-an-upbeat-market/articleshow/113182829.cms,2024-09-09T05:40:19Z,The Nifty Pharma index was trading 0.02 per cent  up  at 23048.45.
Shree Cements shares up 0.2% as Nifty gains,https://economictimes.indiatimes.com/markets/stocks/stock-watch/shree-cements-shares-up-0-2-as-nifty-gains/articleshow/113182746.cms,2024-09-09T05:36:21Z,A total of 284 shares changed hands on the counter till time (IST).
Stock market update: Nifty Bank index advances 0.36% in an upbeat market,https://economictimes.indiatimes.com/markets/stocks/stock-watch/stock-market-update-nifty-bank-index-advances-0-36-in-an-upbeat-market/articleshow/113182718.cms,2024-09-09T05:35:14Z,The Nifty Bank index was trading 0.36 per cent  up  at 50758.75.
"Nifty Prediction today – Sep 9, 2024: Yet to establish intraday trend; fresh trades can wait",https://www.thehindubusinessline.com/portfolio/technical-analysis/nifty-prediction-today-sep-9-2024-yet-to-establish-intraday-trend-fresh-trades-can-wait/article68620814.ece,2024-09-09T05:33:29Z,"Nifty 50 index hovers around 24,840 with bearish bias, top gainer Tata Consumer Products, top loser ONGC."
Avenue Supermart shares drop 0.8% as Sensex rises,https://economictimes.indiatimes.com/markets/stocks/stock-watch/avenue-supermart-shares-drop-0-8-as-sensex-rises/articleshow/113182634.cms,2024-09-09T05:31:16Z,The stock quoted a 52-week high of Rs 5356.05 and a 52-week low of Rs 3617.3.
Share price of Crompton Greaves rises as Nifty strengthens,https://economictimes.indiatimes.com/markets/stocks/stock-watch/share-price-of-crompton-greaves-rises-as-nifty-strengthens/articleshow/113182485.cms,2024-09-09T05:26:05Z,"A total of 12,166 shares changed hands on the counter till 10:55AM (IST)."
Stock market update: Power stocks down as market rises,https://economictimes.indiatimes.com/markets/stocks/stock-watch/stock-market-update-power-stocks-down-as-market-rises/articleshow/113182432.cms,2024-09-09T05:25:04Z,The 30-share BSE Sensex was  up  165.77 points at 81349.7
Share market update: Most active stocks on D-Street today in terms of volume,https://economictimes.indiatimes.com/markets/stocks/stock-watch/share-market-update-most-active-stocks-on-d-street-today-in-terms-of-volume/articleshow/113182244.cms,2024-09-09T05:19:59Z,The NSE Nifty index was trading 58.15 points  up  at 24910.3
Sensex rises! But these stocks are down 5% or more on BSE,https://economictimes.indiatimes.com/markets/stocks/stock-watch/sensex-rises-but-these-stocks-are-down-5-or-more-on-bse/articleshow/113181944.cms,2024-09-09T05:09:50Z,"In the Nifty pack, 20 stocks were trading in the green, while 30 stocks were trading in the red."
Stock market update: Fertilisers stocks down as market falls,https://economictimes.indiatimes.com/markets/stocks/stock-watch/stock-market-update-fertilisers-stocks-down-as-market-falls/articleshow/113181849.cms,2024-09-09T05:04:45Z,The 30-share BSE Sensex was  down  30.64 points at 81153.29
Broader mkt underperforms; PSU banks slide,https://www.business-standard.com/markets/capital-market-news/broader-mkt-underperforms-psu-banks-slide-124090900235_1.html,2024-09-09T05:04:00Z,"At 10:30 IST, the barometer index, the S&P BSE Sensex, shed 23.38 points or 0.03% to 81,160.55. The Nifty 50 index lost 12.10 points or 0.05% to 24,840.05."
